<?xml version="1.0" encoding="UTF-8" standalone="no"?>
<!DOCTYPE jlc SYSTEM "jlc.dtd" >
<jlc>
  <student sid="JLC-999" bid="MK-16-252">
  <sname>abc</sname>
  <email>saurabh@jlc</email>
  <email>sa</email>
  <phone>9999</phone>
  </student>
  
  <course cid="56">
  <cname>Java</cname>
  <cost>555</cost>
  <company>&comp;</company>
  </course>
  <course cid="56">
  <cname>Java</cname>
  <cost>555</cost>
  <company>&comp;</company>
  </course>
  <course cid="56">
  <cname>Java</cname>
  <cost>555</cost>
  <company>&comp;</company>
  </course>
</jlc>
